<?xml version="1.0"?>
<!DOCTYPE daysofweek SYSTEM "timetables.dtd">
<daysofweek>
	<day dow="M">
		<booking time="8:30" course="Comp4560" room="SE12-320" instructor="Brenda Fine" type="Lab" />
		<booking time="11:30" course="Comp4735" room="SW5-1840" instructor="Mirela Gutica" type="Lecture" />
		<booking time="15::30" course="Comp4735" room="SE12-322" instructor="Matt Linder" type="Lab" />
	</day>
	<day dow="T">
		<booking time="12:30" course="Comp4711" room="SE12-320" instructor="Jim Parry" type="Lab" />
		<booking time="13:30" course="Comp4945" room="SE12-319" instructor="Tejinder Randahwa" type="Lecture/Lab" />
		<booking time="14:30" course="Comp4711" room="SW5-1840" instructor="Jim Parry" type="Lecture" />
	</day>
	<day dow="W">
		<booking time="9:30" course="Comp4945" room="SE12-319" instructor="Tejinder Randahwa" type="Lecture/Lab" />
		<booking time="10:30" course="Comp4941" room="SE12-319" instructor="Tejinder Randahwa" type="Lecture/Lab" />
		<booking time="13:30" course="Comp4735" room="SW1-1205" instructor="Mirela Gutica" type="Lecture" />
	</day>
	<day dow="R">
		<booking time="11:30" course="Comp4735" room="SW3-1710" instructor="Mirela Gutica" type="Lecture" />
		<booking time="9:30" course="Blaw3600" room="SW3-3620" instructor="Catherine Ryan" type="Lecture" />
		<booking time="13:30" course="Comp4945" room="SE12-319" instructor="Tejinder Randahwa" type="Lecture/Lab" />
	</day>
	<day dow="F">
		<booking time="8:30" course="Blaw3600" room="SW5-1850" instructor="Catherine Ryan" type="Lecture" />
		<booking time="12:30" course="Comp4560" room="SW1-1021" instructor="Brenda Fine" type="Lecture" />
		<booking time="13:30" course="Comp4941" room="SE12-319" instructor="Tejinder Randahwa" type="Lecture/Lab" />
	</day>
</daysofweek>