<?xml version="1.0"?>
<!DOCTYPE timeslots SYSTEM "timetables.dtd">
<timeslots>
	<slot time="8:30">
		<booking day="M" course="Comp4560" room="SE12-320" instructor="Brenda Fine" type="Lab" />
		<booking day="F" course="Blaw3600" room="SW5-1850" instructor="Catherine Ryan" type="Lecture" />
	</slot>	
	<slot time="9:30">
		<booking day="W" course="Comp4945" room="SE12-319" instructor="Tejinder Randahwa" type="Lecture/Lab" />
		<booking day="R" course="Blaw3600" room="SW3-3620" instructor="Catherine Ryan" type="Lecture" />
	</slot>	
	<slot time="10:30">
		<booking day="W" course="Comp4941" room="SE12-319" instructor="Tejinder Randahwa" type="Lecture/Lab" />
	</slot>	
	<slot time="11:30">
		<booking day="M" course="Comp4735" room="SW5-1840" instructor="Mirela Gutica" type="Lecture" />
		<booking day="T" course="Comp4560" room="SW5-1850" instructor="Brenda Fine" type="Lecture" />
		<booking day="R" course="Comp4735" room="SW3-1710" instructor="Mirela Gutica" type="Lecture" />
	</slot>	
	<slot time="12:30">
		<booking day="T" course="Comp4711" room="SE12-320" instructor="Jim Parry" type="Lab" />
		<booking day="F" course="Comp4560" room="SW1-1021" instructor="Brenda Fine" type="Lecture" />
	</slot>	
	<slot time="13:30">
		<booking day="W" course="Comp4735" room="SW1-1205" instructor="Mirela Gutica" type="Lecture" />
		<booking day="R" course="Comp4945" room="SE12-319" instructor="Tejinder Randahwa" type="Lecture/Lab" />
		<booking day="F" course="Comp4941" room="SE12-319" instructor="Tejinder Randahwa" type="Lecture/Lab" />
	</slot>	
	<slot time="14:30">
		<booking day="T" course="Comp4711" room="SW5-1840" instructor="Jim Parry" type="Lecture" />
	</slot>	
	<slot time="15:30">
		<booking day="M" course="Comp4735" room="SE12-322" instructor="Matt Linder" type="Lab" />
	</slot>	
	<slot time="16:30">
	</slot>	
</timeslots>